{
  "$schema": "../../building-assembly.schema.json",
  "schemaVersion": 1,
  "id": "nod_repair_facility",
  "displayName": "Nod Repair Facility",
  "team": "Nod",
  "sourcePrefix": "mnrep",
  "coordinateSpace": "building_local",
  "models": {
    "shell": [
      {
        "id": "repair_pad",
        "kind": "exterior",
        "model": "data/buildings/nod/mnrep/mnrep.w3d",
        "position": [
          0,
          0,
          0
        ],
        "rotationDegrees": [
          0,
          0,
          0
        ],
        "loadByDefault": true
      }
    ],
    "buildingAggregates": [
      {
        "id": "aggregate_1",
        "kind": "buildingAggregate",
        "model": "data/buildings/nod/mnrep/MNrep_ag_1.w3d",
        "position": [
          0,
          0,
          0
        ],
        "rotationDegrees": [
          0,
          0,
          0
        ],
        "loadByDefault": true,
        "behavior": "BuildingAggregate"
      }
    ],
    "animatedParts": [],
    "specialParts": [],
    "stateVariants": [],
    "authoringOnly": [
      {
        "id": "visx",
        "kind": "visibilityHelper",
        "model": "data/buildings/nod/mnrep/mnrep_visx.w3d",
        "position": [
          0,
          0,
          0
        ],
        "rotationDegrees": [
          0,
          0,
          0
        ],
        "loadByDefault": false
      }
    ]
  },
  "gameplayObjects": {
    "proxySources": [
      "data/buildings/nod/mnrep/mnrep.w3d",
      "data/buildings/nod/mnrep/MNrep_ag_1.w3d"
    ],
    "notes": "Repair-zone bounds must be filled after inspecting the compiled pad collision or proxy data."
  },
  "anchors": {
    "purchaseTerminals": [],
    "masterControlTerminals": [],
    "infantrySpawns": [],
    "vehicleSpawns": [],
    "vehicleExits": [],
    "repairZones": []
  }
}
