{
  "$schema": "../../building-assembly.schema.json",
  "schemaVersion": 1,
  "id": "nod_shrine",
  "displayName": "Nod Shrine",
  "team": "Nod",
  "sourcePrefix": "mnshn",
  "coordinateSpace": "building_local",
  "models": {
    "shell": [
      {
        "id": "exterior",
        "kind": "exterior",
        "model": "data/buildings/nod/mnshn/mnshn_ext.w3d",
        "position": [
          0,
          0,
          0
        ],
        "rotationDegrees": [
          0,
          0,
          0
        ],
        "loadByDefault": true
      },
      {
        "id": "interior",
        "kind": "interior",
        "model": "data/buildings/nod/mnshn/mnshn_int.w3d",
        "position": [
          0,
          0,
          0
        ],
        "rotationDegrees": [
          0,
          0,
          0
        ],
        "loadByDefault": true
      }
    ],
    "buildingAggregates": [
      {
        "id": "aggregate_1",
        "kind": "buildingAggregate",
        "model": "data/buildings/nod/mnshn/MNshn_ag_1.w3d",
        "position": [
          0,
          0,
          0
        ],
        "rotationDegrees": [
          0,
          0,
          0
        ],
        "loadByDefault": true,
        "behavior": "BuildingAggregate"
      },
      {
        "id": "aggregate_2",
        "kind": "buildingAggregate",
        "model": "data/buildings/nod/mnshn/MNshn_ag_2.w3d",
        "position": [
          0,
          0,
          0
        ],
        "rotationDegrees": [
          0,
          0,
          0
        ],
        "loadByDefault": true,
        "behavior": "BuildingAggregate"
      },
      {
        "id": "aggregate_3",
        "kind": "buildingAggregate",
        "model": "data/buildings/nod/mnshn/MNshn_ag_3.w3d",
        "position": [
          0,
          0,
          0
        ],
        "rotationDegrees": [
          0,
          0,
          0
        ],
        "loadByDefault": true,
        "behavior": "BuildingAggregate"
      }
    ],
    "animatedParts": [
      {
        "id": "doors",
        "kind": "doorSet",
        "model": "data/buildings/nod/mnshn/mnshn_doors.w3d",
        "position": [
          0,
          0,
          0
        ],
        "rotationDegrees": [
          0,
          0,
          0
        ],
        "loadByDefault": true,
        "behavior": "DoorPhys"
      }
    ],
    "specialParts": [
      {
        "id": "lighting_fix",
        "kind": "lights",
        "model": "data/buildings/nod/mnshn/mnshn_lt_fix.w3d",
        "position": [
          0,
          0,
          0
        ],
        "rotationDegrees": [
          0,
          0,
          0
        ],
        "loadByDefault": true
      }
    ],
    "stateVariants": [
      {
        "id": "exterior_night",
        "kind": "nightVariant",
        "model": "data/buildings/nod/mnshn/mnshn_ext_n.w3d",
        "position": [
          0,
          0,
          0
        ],
        "rotationDegrees": [
          0,
          0,
          0
        ],
        "loadByDefault": false,
        "replaces": "exterior"
      },
      {
        "id": "interior_night",
        "kind": "nightVariant",
        "model": "data/buildings/nod/mnshn/mnshn_int_n.w3d",
        "position": [
          0,
          0,
          0
        ],
        "rotationDegrees": [
          0,
          0,
          0
        ],
        "loadByDefault": false,
        "replaces": "interior"
      },
      {
        "id": "aggregate_3_night",
        "kind": "nightVariant",
        "model": "data/buildings/nod/mnshn/MNshn_ag_3n.w3d",
        "position": [
          0,
          0,
          0
        ],
        "rotationDegrees": [
          0,
          0,
          0
        ],
        "loadByDefault": false,
        "replaces": "aggregate_3"
      }
    ],
    "authoringOnly": [
      {
        "id": "interior_temp",
        "kind": "temporarySource",
        "model": "data/buildings/nod/mnshn/temp.w3d",
        "position": [
          0,
          0,
          0
        ],
        "rotationDegrees": [
          0,
          0,
          0
        ],
        "loadByDefault": false
      },
      {
        "id": "vis",
        "kind": "visibilityHelper",
        "model": "data/buildings/nod/mnshn/mnshn_vis.w3d",
        "position": [
          0,
          0,
          0
        ],
        "rotationDegrees": [
          0,
          0,
          0
        ],
        "loadByDefault": false
      },
      {
        "id": "visx",
        "kind": "visibilityHelper",
        "model": "data/buildings/nod/mnshn/mnshn_visx.w3d",
        "position": [
          0,
          0,
          0
        ],
        "rotationDegrees": [
          0,
          0,
          0
        ],
        "loadByDefault": false
      },
      {
        "id": "temporary_ground",
        "kind": "temporarySource",
        "model": "data/buildings/nod/mnshn/tmp_ground.w3d",
        "position": [
          0,
          0,
          0
        ],
        "rotationDegrees": [
          0,
          0,
          0
        ],
        "loadByDefault": false
      }
    ]
  },
  "gameplayObjects": {
    "proxySources": [
      "data/buildings/nod/mnshn/mnshn_int.w3d",
      "data/buildings/nod/mnshn/MNshn_ag_2.w3d",
      "data/buildings/nod/mnshn/MNshn_ag_3.w3d"
    ],
    "notes": "Compile with W3D proxies preserved; resolve PT and MCT presets and transforms from these proxy-bearing models."
  },
  "anchors": {
    "purchaseTerminals": [],
    "masterControlTerminals": [],
    "infantrySpawns": [],
    "vehicleSpawns": [],
    "vehicleExits": [],
    "repairZones": []
  }
}
