{
  "$schema": "../../building-assembly.schema.json",
  "schemaVersion": 1,
  "id": "gdi_construction_yard",
  "displayName": "GDI Construction Yard",
  "team": "GDI",
  "sourcePrefix": "mgcon",
  "coordinateSpace": "building_local",
  "models": {
    "shell": [
      {
        "id": "exterior",
        "kind": "exterior",
        "model": "data/buildings/gdi/mgcon/mgcon_ext.w3d",
        "position": [
          0,
          0,
          0
        ],
        "rotationDegrees": [
          0,
          0,
          0
        ],
        "loadByDefault": true
      },
      {
        "id": "interior",
        "kind": "interior",
        "model": "data/buildings/gdi/mgcon/mgcon_int.w3d",
        "position": [
          0,
          0,
          0
        ],
        "rotationDegrees": [
          0,
          0,
          0
        ],
        "loadByDefault": true,
        "notes": "Source filename contains a stray space; compile as mgcon_int.w3d."
      }
    ],
    "buildingAggregates": [
      {
        "id": "aggregate_1",
        "kind": "buildingAggregate",
        "model": "data/buildings/gdi/mgcon/MGcon_ag_1.w3d",
        "position": [
          0,
          0,
          0
        ],
        "rotationDegrees": [
          0,
          0,
          0
        ],
        "loadByDefault": true,
        "behavior": "BuildingAggregate"
      },
      {
        "id": "aggregate_2",
        "kind": "buildingAggregate",
        "model": "data/buildings/gdi/mgcon/MGcon_ag_2.w3d",
        "position": [
          0,
          0,
          0
        ],
        "rotationDegrees": [
          0,
          0,
          0
        ],
        "loadByDefault": true,
        "behavior": "BuildingAggregate"
      },
      {
        "id": "aggregate_3",
        "kind": "buildingAggregate",
        "model": "data/buildings/gdi/mgcon/MGcon_ag_3.w3d",
        "position": [
          0,
          0,
          0
        ],
        "rotationDegrees": [
          0,
          0,
          0
        ],
        "loadByDefault": true,
        "behavior": "BuildingAggregate"
      }
    ],
    "animatedParts": [
      {
        "id": "doors",
        "kind": "doorSet",
        "model": "data/buildings/gdi/mgcon/mgcon_doors.w3d",
        "position": [
          0,
          0,
          0
        ],
        "rotationDegrees": [
          0,
          0,
          0
        ],
        "loadByDefault": true,
        "behavior": "DoorPhys"
      }
    ],
    "specialParts": [],
    "stateVariants": [
      {
        "id": "exterior_night",
        "kind": "nightVariant",
        "model": "data/buildings/gdi/mgcon/mgcon_ext_n.w3d",
        "position": [
          0,
          0,
          0
        ],
        "rotationDegrees": [
          0,
          0,
          0
        ],
        "loadByDefault": false,
        "replaces": "exterior"
      }
    ],
    "authoringOnly": []
  },
  "gameplayObjects": {
    "proxySources": [
      "data/buildings/gdi/mgcon/mgcon_int.w3d",
      "data/buildings/gdi/mgcon/MGcon_ag_2.w3d",
      "data/buildings/gdi/mgcon/MGcon_ag_3.w3d"
    ],
    "notes": "Compile with W3D proxies preserved; resolve PT and MCT presets and transforms from these proxy-bearing models."
  },
  "anchors": {
    "purchaseTerminals": [],
    "masterControlTerminals": [],
    "infantrySpawns": [],
    "vehicleSpawns": [],
    "vehicleExits": [],
    "repairZones": []
  }
}
